{
  "contract": {
    "name": "lumen.ir",
    "version": "0.2.5",
    "producer": "donbox/formula-language"
  },
  "name": "main",
  "input": {
    "name": "main.input",
    "fields": [],
    "origin": {
      "uri": "examples/lumen/check-repair-pending.lumen",
      "line": 0,
      "col": 0
    }
  },
  "nodes": [
    {
      "kind": "repeat",
      "id": "repeat_1",
      "after": [],
      "origin": {
        "uri": "examples/lumen/check-repair-pending.lumen",
        "line": 1,
        "col": 0
      },
      "body": {
        "kind": "do",
        "id": "lane",
        "name": "lane",
        "after": [],
        "origin": {
          "uri": "examples/lumen/check-repair-pending.lumen",
          "line": 1,
          "col": 9
        },
        "source": {
          "kind": "prompt"
        },
        "interpreter": {
          "kind": "agent",
          "mode": {
            "kind": "do"
          },
          "origin": {
            "uri": "examples/lumen/check-repair-pending.lumen",
            "line": 1,
            "col": 9
          }
        },
        "body": {
          "raw": "Poll the CI check; if it is still running settle pending, otherwise repair and settle.",
          "template": {
            "parts": [
              {
                "kind": "text",
                "value": "Poll the CI check; if it is still running settle pending, otherwise repair and settle."
              }
            ]
          },
          "source": {
            "kind": "inline"
          },
          "templated": true,
          "language": "markdown",
          "syntax": "bare",
          "origin": {
            "uri": "examples/lumen/check-repair-pending.lumen",
            "line": 1,
            "col": 9
          }
        }
      },
      "cond": {
        "kind": "operator",
        "op": "||",
        "operands": [
          {
            "kind": "operator",
            "op": "==",
            "operands": [
              {
                "kind": "ref",
                "name": "lane",
                "field": "outcome",
                "origin": {
                  "uri": "examples/lumen/check-repair-pending.lumen",
                  "line": 1,
                  "col": 74
                }
              },
              {
                "kind": "literal",
                "value": "succeeded"
              }
            ]
          },
          {
            "kind": "operator",
            "op": ">=",
            "operands": [
              {
                "kind": "ref",
                "name": "iteration",
                "origin": {
                  "uri": "examples/lumen/check-repair-pending.lumen",
                  "line": 1,
                  "col": 98
                }
              },
              {
                "kind": "literal",
                "value": 1
              }
            ]
          }
        ]
      },
      "iterationName": "iteration"
    }
  ],
  "origin": {
    "uri": "examples/lumen/check-repair-pending.lumen",
    "line": 0,
    "col": 0
  }
}
