{
  "contract": {
    "name": "lumen.ir",
    "version": "0.2.5",
    "producer": "donbox/formula-language"
  },
  "name": "guard-do",
  "origin": {"uri": "examples/lumen/guard-do.lumen.json", "line": 6, "col": 0},
  "input": {
    "name": "guard-do.input",
    "origin": {"uri": "examples/lumen/guard-do.lumen.json", "line": 9, "col": 0},
    "fields": [
      {
        "name": "mode",
        "type": { "kind": "atomic", "name": "string" },
        "required": true,
        "body": false
      }
    ]
  },
  "nodes": [
    {
      "kind": "guard",
      "id": "g",
      "name": "g",
      "after": [],
      "origin": {"uri": "examples/lumen/guard-do.lumen.json", "line": 25, "col": 0},
      "cond": {
        "kind": "operator",
        "op": "==",
        "operands": [
          { "kind": "ref", "name": "mode" },
          { "kind": "literal", "value": "go" }
        ]
      },
      "then": {
        "kind": "do",
        "id": "gthen",
        "name": "gthen",
        "after": [],
        "origin": {"uri": "examples/lumen/guard-do.lumen.json", "line": 38, "col": 0},
        "source": { "kind": "prompt" },
        "interpreter": { "kind": "agent", "mode": { "kind": "do" } },
        "body": { "raw": "Do the gated work, then settle this step." },
        "exitMap": { "pass": [0], "retryable": [] }
      }
    }
  ]
}
